{
  "agreement": "Synthetic DPA: EEA-only processing that lists no categories of data subjects",
  "controller": "Example Controller GmbH (synthetic)",
  "processor": "Example Processor SE (synthetic)",
  "processing": {
    "subject_matter": "Hosting and support of the controller's CRM system",
    "duration": "The term of the main services agreement",
    "nature_and_purpose": "Storage, backup and support access to provide the CRM service",
    "data_types": [
      "contact data",
      "contract data"
    ]
  },
  "art28_clauses": {
    "process_on_documented_instructions": true,
    "confidentiality_commitment": true,
    "security_measures_art32": true,
    "subprocessor_authorization": "specific",
    "subprocessor_flowdown": true,
    "assist_data_subject_requests": true,
    "assist_security_breach": true,
    "delete_or_return_on_termination": true,
    "audit_and_inspection_rights": true
  },
  "breach_notification": {
    "processor_notifies_controller": true,
    "timing": "without undue delay"
  },
  "subprocessors": [
    {
      "name": "Example Hosting GmbH",
      "country": "DE",
      "purpose": "hosting"
    }
  ],
  "transfers": {
    "destinations": [],
    "transfer_impact_assessment": false
  },
  "ccpa": {
    "service_provider_terms": true
  },
  "evidence": {
    "art28_clauses.subprocessor_flowdown": {
      "clause": "§ 7.2",
      "quote": "The Processor shall impose the same data protection obligations as set out in this Agreement on every Sub-processor."
    },
    "breach_notification.timing": {
      "clause": "§ 9.1",
      "quote": "The Processor shall notify the Controller without undue delay after becoming aware of a Personal Data Breach."
    },
    "subprocessors[0]": {
      "clause": "Annex 3",
      "quote": "Example Hosting GmbH, Frankfurt am Main, Germany: hosting."
    }
  }
}
